{
  "name": "Stonemason",
  "activityBonusRules": [
    {
      "value": 1,
      "activity": "establish-work-site-quarry"
    }
  ],
  "storage": {
    "stone": 1
  },
  "traits": [
    "building"
  ],
  "affectsDowntime": false,
  "reducesUnrest": false,
  "level": 3,
  "construction": {
    "rp": 16,
    "lumber": 2,
    "skills": [
      {
        "skill": "industry",
        "proficiencyRank": 1
      }
    ],
    "dc": 18
  },
  "lots": 2
}