{
    "name": "Waterfront",
    "activityBonusRules": [
        {
            "value": 1,
            "activity": "go-fishing"
        },
        {
            "value": 1,
            "activity": "establish-trade-agreement"
        }
    ],
    "availableItemsRules": [
        {
            "value": 1,
            "maximumStacks": 1,
            "alwaysStacks": true
        }
    ],
    "traits": [
        "yard"
    ],
    "affectsDowntime": false,
    "reducesUnrest": false,
    "level": 8,
    "upgradeFrom": [
        "Pier",
        "Pier (V&K)"
    ],
    "construction": {
        "rp": 90,
        "lumber": 10,
        "skills": [
            {
                "skill": "boating",
                "proficiencyRank": 2
            }
        ],
        "dc": 24
    },
    "lots": 4
}